{
  "schemaVersion": 2,
  "protocolId": "cardiac-cath-uw",
  "version": 1,
  "owner": "Test fixture",
  "reviewBy": "2027-04-10",
  "timezone": "America/Los_Angeles",
  "departmentDefaults": {
    "morningReminder": "07:00",
    "eveningReminder": "20:00",
    "reminderLead": "PT2H"
  },
  "baseModule": {
    "moduleId": "cardiac-cath-uw-base",
    "version": 1,
    "sha256": "c26f275da38a00f88994b05e2b8f92962349fa15ea405b88bb4bfa577df1d16c"
  },
  "optionalModules": [
    {
      "moduleId": "cardiac-cath-uw-sedation",
      "version": 1,
      "sha256": "7d361e4c2a2fe651c956a2f0a3b48742984c137c38ea0709e4cda3732b186e0c",
      "selectedAt": "discharge"
    },
    {
      "moduleId": "cardiac-cath-uw-groin-site",
      "version": 1,
      "sha256": "ac05fa2355c59a13a08e4ded02204c50b529cbf024518eef7b5d5334489c091b",
      "selectedAt": "discharge"
    },
    {
      "moduleId": "cardiac-cath-uw-arm-site",
      "version": 1,
      "sha256": "2538ad7a0879f3c07e0e12ebf45d64d7d426e6cf17a4a11e6ab707972f04fbfe",
      "selectedAt": "discharge"
    },
    {
      "moduleId": "cardiac-cath-uw-stent",
      "version": 1,
      "sha256": "2490dd324780fef1f129a6ce11427af38eb709b471ab55f2067f6e03cf57840b",
      "selectedAt": "discharge"
    }
  ],
  "allowedCombinations": {
    "rule": "anySubset",
    "exactlyOneOf": [
      {
        "selectBy": "clinician",
        "modules": [
          "cardiac-cath-uw-groin-site",
          "cardiac-cath-uw-arm-site"
        ]
      }
    ]
  },
  "source": [
    "https://healthonline.washington.edu/sites/default/files/record_pdfs/How-to-Prepare-for-Your-Heart-Catheterization_a11y.pdf"
  ],
  "accessed": "2026-10-10",
  "note": "Test data only. Not clinical guidance.",
  "signature": ""
}
